date,title,source,desc,url,img
2023-05-24,Tesla Model Y Owner Shares 8 Reasons To Avoid The Electric SUV,InsideEVs,"Matt Danadel, the owner of two Tesla Model Y electric SUVs, tells us why you might not want to buy a Model Y.",https://insideevs.com/news/668922/reasons-to-avoid-the-tesla-model-y/,"data:image/gif;base64,R0lGODlhAQABAIAAAP///////yH5BAEKAAEALAAAAAABAAEAAAICTAEAOw=="
2023-05-24,"Tesla's reputation slumps as GM, Ford climb",Axios,Tesla Motors' brand reputation dipped over the last year as CEO Elon Musk made headlines for a range of controversies.,https://www.axios.com/2023/05/24/tesla-reputation,"data:image/gif;base64,R0lGODlhAQABAIAAAP///////yH5BAEKAAEALAAAAAABAAEAAAICTAEAOw=="
2023-05-24,Tesla's Image Suffers Blow: EV Giant Drops 50 Spots In List Of Most Reputable US Brands - Tesla (NASDAQ:TSLA ...,Benzinga,Be Smarter Than Your Friends: Benzinga members get 3 trade opportunities & the hot takes on the economy every single week. Stop Missing Out! Advertorial...,https://www.benzinga.com/markets/equities/23/05/32550575/teslas-image-suffers-blow-ev-giant-drops-50-spots-in-list-of-most-reputable-us-brands,"data:image/gif;base64,R0lGODlhAQABAIAAAP///////yH5BAEKAAEALAAAAAABAAEAAAICTAEAOw=="
2023-05-24,Elon Musk: AI will change human race 'a lot',Axios,Elon Musk appears to be readying a new project to enter the AI arena against Microsoft and OpenAI. Why it matters: His plans could involve harnessing...,https://www.axios.com/2023/05/23/elon-musk-ai-regulation-china,"data:image/gif;base64,R0lGODlhAQABAIAAAP///////yH5BAEKAAEALAAAAAABAAEAAAICTAEAOw=="
2023-05-24,Chinese Tesla rival shares dive 11% after it forecasts a plunge in car deliveries,CNBC,Shares of Chinese electric vehicle firm Xpeng dropped on Wednesday after the company reported earnings that missed expectations and forecast a plunge in car...,https://www.cnbc.com/2023/05/24/xpeng-xpev-q1-2023-earnings-report-deliveries-forecast-to-fall.html,"data:image/gif;base64,R0lGODlhAQABAIAAAP///////yH5BAEKAAEALAAAAAABAAEAAAICTAEAOw=="
2023-05-24,"Nio, Tesla stocks fall in wake of disappointing XPeng results",MarketWatch,"Shares of Nio Inc. slumped 1.9% in premarket trading Wednesday, weighed down by rival China-based electric vehicle maker XPeng Inc. reported first-quarter.",https://www.marketwatch.com/story/nio-tesla-stocks-fall-in-wake-of-disappointing-xpeng-results-f4c0633,"data:image/gif;base64,R0lGODlhAQABAIAAAP///////yH5BAEKAAEALAAAAAABAAEAAAICTAEAOw=="
2023-05-24,A Tesla Rival Is in Big Trouble,TheStreet,"Lordstown Motors just announced a reverse stock split, to avert delisting from the Nasdaq and to persuade its main investor not to abandon the company.",https://www.thestreet.com/technology/a-tesla-rival-is-in-big-trouble,"data:image/gif;base64,R0lGODlhAQABAIAAAP///////yH5BAEKAAEALAAAAAABAAEAAAICTAEAOw=="
2023-05-24,Best Stock to Buy: Tesla vs. Plug Power,The Motley Fool,An interesting comparison between the pioneer of EVs and an innovative energy company.,https://www.fool.com/investing/2023/05/24/best-stock-to-buy-tesla-stock-vs-plug-power-stock/,"data:image/gif;base64,R0lGODlhAQABAIAAAP///////yH5BAEKAAEALAAAAAABAAEAAAICTAEAOw=="
2023-05-24,Prediction: This Cathie Wood AI Stock Will Be 1 of the Top 5 Largest Companies by 2030,The Motley Fool,"Tesla (TSLA -2.40%) has long held the attention of Cathie Wood and her team at Ark Invest, becoming its largest position. Many likely assume that its lead...",https://www.fool.com/investing/2023/05/24/prediction-cathie-wood-ai-stock-top-5-2030/,"data:image/gif;base64,R0lGODlhAQABAIAAAP///////yH5BAEKAAEALAAAAAABAAEAAAICTAEAOw=="
2023-05-24,BIG INVESTMENT DESTINATION! Tesla Factory In India Soon? Elon Musk Drops Major Hint – Details,Times Now,"Tesla in India: Elon Musk selected Mexico for the next Tesla Gigafactory in March this year. The company has several factories in different locations of US,...",https://www.timesnownews.com/business-economy/companies/big-investment-destination-tesla-factory-in-india-soon-elon-musk-drops-major-hint-details-article-100469960,"data:image/gif;base64,R0lGODlhAQABAIAAAP///////yH5BAEKAAEALAAAAAABAAEAAAICTAEAOw=="
